<?xml version="1.0" encoding="UTF-8" ?>
<container xmlns:xsi= "http://www.w3.org/2001/XMLSchema-instance"
   	xsi:noNamespaceSchemaLocation="ContentDirectoryDef.xsd"
    title_key="serviio_media_library" id="0" containerClass="CONTAINER" cacheRegion="no_cache">
    
	<container title_key="audio" id="A" editable="true" containerClass="CONTAINER" cacheRegion="no_cache"> <!-- see org.serviio.upnp.service.contentdirectory.definition.Definition for container id -->
		<container title_key="artists" id="A_A" editable="true" containerClass="CONTAINER" cacheRegion="local_default">		
			<action command="org.serviio.upnp.service.contentdirectory.command.person.ListArtistInitialsCommand" idPrefix="INI" containerClass="CONTAINER" cacheRegion="local_default">
				<action command="org.serviio.upnp.service.contentdirectory.command.person.ListArtistsForInitialCommand" idPrefix="ART" containerClass="MUSIC_ARTIST" cacheRegion="local_default">
					<action command="org.serviio.upnp.service.contentdirectory.command.audio.ListAlbumsForArtistCommand" idPrefix="A" containerClass="MUSIC_ALBUM" cacheRegion="local_default">
						<action command="org.serviio.upnp.service.contentdirectory.command.audio.ListSongsForArtistAndAlbumCommand" idPrefix="S" itemClass="MUSIC_TRACK" cacheRegion="local_default" />	
					</action>
				</action>							
			</action>
		</container>
		<container title_key="album_artists" id="AL_A" editable="true" containerClass="CONTAINER" cacheRegion="local_default">		
			<action command="org.serviio.upnp.service.contentdirectory.command.person.ListAlbumArtistInitialsCommand" idPrefix="INI" containerClass="CONTAINER" cacheRegion="local_default">
				<action command="org.serviio.upnp.service.contentdirectory.command.person.ListAlbumArtistsForInitialCommand" idPrefix="ART" containerClass="MUSIC_ARTIST" cacheRegion="local_default">
					<action command="org.serviio.upnp.service.contentdirectory.command.audio.ListAlbumsForAlbumArtistCommand" idPrefix="A" containerClass="MUSIC_ALBUM" cacheRegion="local_default">						
						<action command="org.serviio.upnp.service.contentdirectory.command.audio.ListSongsForAlbumCommand" idPrefix="S" itemClass="MUSIC_TRACK" cacheRegion="local_default" />
					</action>
				</action>							
			</action>
		</container>				
		<container title_key="folders" id="A_F" editable="true" containerClass="CONTAINER" cacheRegion="local_default">	
			<action command="org.serviio.upnp.service.contentdirectory.command.audio.ListAudioFoldersByNameCommand" idPrefix="FOL" recursive="true" containerClass="STORAGE_FOLDER" itemClass="MUSIC_TRACK" cacheRegion="local_default"/>				
		</container>	
		<container title_key="genres" id="A_G" editable="true" containerClass="CONTAINER" cacheRegion="local_default">		
			<action command="org.serviio.upnp.service.contentdirectory.command.audio.ListAudioGenresByNameCommand" idPrefix="GEN" containerClass="MUSIC_GENRE" cacheRegion="local_default">				
				<action command="org.serviio.upnp.service.contentdirectory.command.audio.ListSongsForGenreCommand" idPrefix="S" itemClass="MUSIC_TRACK" cacheRegion="local_default" />
			</action>
		</container>
		<container title_key="composers" id="A_C" editable="true" containerClass="CONTAINER" cacheRegion="local_default">		
			<action command="org.serviio.upnp.service.contentdirectory.command.person.ListComposerInitialsCommand" idPrefix="INI" containerClass="CONTAINER" cacheRegion="local_default">
				<action command="org.serviio.upnp.service.contentdirectory.command.person.ListComposersForInitialCommand" idPrefix="COM" containerClass="MUSIC_ARTIST" cacheRegion="local_default">
					<action command="org.serviio.upnp.service.contentdirectory.command.audio.ListAlbumsForComposerCommand" idPrefix="A" containerClass="MUSIC_ALBUM" cacheRegion="local_default">
						<action command="org.serviio.upnp.service.contentdirectory.command.audio.ListSongsForComposerAndAlbumCommand" idPrefix="S" itemClass="MUSIC_TRACK" cacheRegion="local_default" />	
					</action>
				</action>							
			</action>
		</container>
		<container title_key="titles" id="A_T" editable="true" containerClass="CONTAINER" cacheRegion="local_default">	
			<action command="org.serviio.upnp.service.contentdirectory.command.audio.ListSongInitialsCommand" idPrefix="INI" containerClass="CONTAINER" cacheRegion="local_default">				
				<action command="org.serviio.upnp.service.contentdirectory.command.audio.ListSongsForInitialCommand" idPrefix="S" itemClass="MUSIC_TRACK" cacheRegion="local_default"/>
			</action>					
		</container> 	
		<container title_key="random" id="A_R" editable="true" containerClass="CONTAINER" cacheRegion="no_cache">	
			<action command="org.serviio.upnp.service.contentdirectory.command.audio.ListRandomSongsCommand" idPrefix="S" itemClass="MUSIC_TRACK" cacheRegion="no_cache" />					
		</container>
		<container title_key="playlists" id="A_PL" editable="true" containerClass="CONTAINER" cacheRegion="local_default">
			<action command="org.serviio.upnp.service.contentdirectory.command.audio.ListAudioPlaylistsCommand" idPrefix="PL" containerClass="PLAYLIST_CONTAINER" cacheRegion="local_default">
				<action command="org.serviio.upnp.service.contentdirectory.command.audio.ListSongsForPlaylistCommand" idPrefix="S" itemClass="MUSIC_TRACK" cacheRegion="local_default"/>
			</action>
		</container>	 
		<container title_key="online" id="A_OF" editable="true" containerClass="CONTAINER" cacheRegion="no_cache">
			<action command="org.serviio.upnp.service.contentdirectory.command.audio.ListAudioOnlineContentCommand" idPrefix="FOL" recursive="true" containerClass="STORAGE_FOLDER" itemClass="MUSIC_TRACK" cacheRegion="no_cache"/>
		</container>	 
		
		<!-- XBOX360 search only categories  -->
		<container title_key="All songs" id="A_S" containerClass="CONTAINER" browsable="false" cacheRegion="local_default">								
			<action command="org.serviio.upnp.service.contentdirectory.command.audio.ListAllSongsCommand" idPrefix="S" itemClass="MUSIC_TRACK" cacheRegion="local_default"/>								
		</container> 		
		<container title_key="Artist Songs" id="A_AS" containerClass="CONTAINER" browsable="false" cacheRegion="local_default">		
			<action command="org.serviio.upnp.service.contentdirectory.command.person.ListArtistsByNameCommand" idPrefix="ART_S" containerClass="MUSIC_ARTIST" cacheRegion="local_default">
				<action command="org.serviio.upnp.service.contentdirectory.command.audio.ListSongsForArtistCommand" idPrefix="S" itemClass="MUSIC_TRACK" cacheRegion="local_default" />				
			</action>
		</container>	
		<container title_key="All albums" id="A_ALB" containerClass="CONTAINER" browsable="false" cacheRegion="local_default">		
			<action command="org.serviio.upnp.service.contentdirectory.command.audio.ListAllAlbumsCommand" idPrefix="ALB" containerClass="MUSIC_ALBUM" cacheRegion="local_default">
				<action command="org.serviio.upnp.service.contentdirectory.command.audio.ListSongsForAlbumCommand" idPrefix="S" itemClass="MUSIC_TRACK" cacheRegion="local_default" />				
			</action>				
		</container>			
	</container>
	<container title_key="image" id="I" editable="true" containerClass="CONTAINER" cacheRegion="no_cache"> <!-- see org.serviio.upnp.service.contentdirectory.definition.Definition for container id -->
		<container title_key="albums" id="I_A" editable="true" containerClass="CONTAINER" cacheRegion="local_default">
			<action command="org.serviio.upnp.service.contentdirectory.command.image.ListFlatImageFoldersByNameCommand" idPrefix="ALB" containerClass="CONTAINER" cacheRegion="local_default">				
				<action command="org.serviio.upnp.service.contentdirectory.command.image.ListImagesForFolderCommand" idPrefix="I" itemClass="PHOTO" cacheRegion="local_default" />
			</action>
		</container>	
		<container title_key="folders" id="I_F" editable="true" containerClass="CONTAINER" cacheRegion="local_default">
			<action command="org.serviio.upnp.service.contentdirectory.command.image.ListImageFoldersByNameCommand" idPrefix="FOL" recursive="true" containerClass="STORAGE_FOLDER" itemClass="PHOTO" cacheRegion="local_default" />				
		</container>	
		<container title_key="year" id="I_Y" editable="true" containerClass="CONTAINER" cacheRegion="local_default">
			<action command="org.serviio.upnp.service.contentdirectory.command.image.ListImagesCreationYearsCommand" idPrefix="YEAR" containerClass="CONTAINER" cacheRegion="local_default">				
				<action command="org.serviio.upnp.service.contentdirectory.command.image.ListImagesForCreationYearCommand" idPrefix="I" itemClass="PHOTO" cacheRegion="local_default" />
			</action>			
		</container>
		<container title_key="month" id="I_T" editable="true" containerClass="CONTAINER" cacheRegion="local_default">
			<action command="org.serviio.upnp.service.contentdirectory.command.image.ListImagesCreationYearsCommand" idPrefix="YEAR" containerClass="CONTAINER" cacheRegion="local_default">				
				<action command="org.serviio.upnp.service.contentdirectory.command.image.ListImagesCreationMonthsCommand" idPrefix="MON" containerClass="CONTAINER" cacheRegion="local_default">
					<action command="org.serviio.upnp.service.contentdirectory.command.image.ListImagesForCreationMonthAndYearCommand" idPrefix="I" itemClass="PHOTO" cacheRegion="local_default" />				
				</action>
			</action>			
		</container>
		<container title_key="playlists" id="I_PL" editable="true" containerClass="CONTAINER" cacheRegion="local_default">
			<action command="org.serviio.upnp.service.contentdirectory.command.image.ListImagePlaylistsCommand" idPrefix="PL" containerClass="PLAYLIST_CONTAINER" cacheRegion="local_default">
				<action command="org.serviio.upnp.service.contentdirectory.command.image.ListImagesForPlaylistCommand" idPrefix="S" itemClass="PHOTO" cacheRegion="local_default"/>
			</action>
		</container>	 
		<container title_key="online" id="I_OF" editable="true" containerClass="CONTAINER" cacheRegion="no_cache">